{
  "sweep_metadata": {
    "cycle_date": "2026-06-06",
    "day_number": 100,
    "framework_version": "v4.2",
    "probes_run": [
      "PROBE-1", "PROBE-2", "PROBE-3", "PROBE-6", "PROBE-7", "PROBE-8",
      "PROBE-9", "PROBE-10", "PROBE-12'", "PROBE-13", "PROBE-14", "PROBE-15",
      "PROBE-16", "PROBE-17", "PROBE-18", "PROBE-20", "PROBE-21"
    ],
    "synthesis_anchor": "synthesis-v4-2.md",
    "notes": "17 probes; 7 fired; 8 partial; 2 null; 0 gap. Day 100 major signals: 5th kinetic cycle (US radar strikes Goruk/Sirik/Qeshm; Iran 7 ballistic missiles Kuwait+Bahrain; 6 intercepted, 1 failed; no US KIA); Lebanon ceasefire collapsed (Hezbollah rejected US-brokered deal; IDF continued strikes; Trump called Netanyahu expletive); MOU at impasse (Trump 'final determination' meeting ended without decision; draft sent back to Iran); MBS strongest condemnation of Iran yet (supports 'any measures' Kuwait/Bahrain take); Putin confirmed SPIEF June 4 (BS-9.3 June sequence not triggered). Covers Days 98-100 (June 4-6).",
    "reference_trends": [
      {"trend_id": "T1", "net_effect": "advance", "note": "Gulf troika: Saudi FM condemnation + MBS-MBZ joint warning on Iranian attacks on GCC members; brake strained but not fractured; Pakistan channel implicitly active on LOI; no intra-troika split confirmed"},
      {"trend_id": "T2", "net_effect": "advance", "note": "Iran fires 7 ballistic missiles (Kuwait+Bahrain) while framing as Hormuz self-defense; denial of civilian targeting is Mosaic-Octopus calibration to manage Gulf relationship; multi-channel capability demonstrated through use"},
      {"trend_id": "T3", "net_effect": "advance", "note": "Two-level structure intact: Trump held final-determination meeting (no decision), sent draft back to Iran; mid-tier 'messages continue' per Araghchi; Lebanon ceasefire collapse does not halt Iran-US channel; apex continues to block via Lebanon clause, mid-tier continues to negotiate"},
      {"trend_id": "T4", "net_effect": "advance", "note": "Trump called Netanyahu expletive; reins in Netanyahu on Lebanon; deal-faction (Trump+Vance+Rubio triad) at maximum friction with maximalist faction; no §5.20 eschatological-coalition counter-mobilization 10th-plus cycle"},
      {"trend_id": "T5", "net_effect": "hold", "note": "Hajj period ended; Temple Mount Tier-2 accumulation continues (prayer pages + pending legislation); no Tier-1 fire; single-tradition Jewish activation only; T5 PENDING holds"},
      {"trend_id": "T6", "net_effect": "hold", "note": "Putin confirmed at SPIEF St. Petersburg June 4 (named appearance, press conference); June count now at least 1; May 1-2; April count still unresolved; BS-9.3 three-consecutive-month threshold NOT triggered (June sequence broken by confirmed appearance)"},
      {"trend_id": "T7", "net_effect": "hold", "note": "Voice discipline maintained; no substrate-as-agent constructions in analytical output"},
      {"trend_id": "T8", "net_effect": "advance", "note": "Lebanon ceasefire collapsed; Netanyahu defying Trump on Lebanon while routing strike decision to Trump; Knesset dissolution advancing through readings; Powell amplifier at maximum loading; deal-direction held by Trump despite Lebanon friction"},
      {"trend_id": "T9", "net_effect": "hold", "note": "Senate not scheduling on-merits WPR vote; White House asserts concurrent resolution unconstitutional (1983 Chadha legislative-veto precedent); T9 disc-ratio 4:10 holds from Day 97; /premortem trend-rigidity review outstanding; VALIDATED holds"},
      {"trend_id": "T10", "net_effect": "hold", "note": "Russia inert across cycle; no new signals"},
      {"trend_id": "T11", "net_effect": "hold", "note": "Lebanon multilateral framework collapsed in practice; but the architecture (US+Lebanon+Israel+Hezbollah attempt) remains multiplex indicator; Gulf multilateral condemnation also multiplex-trajectory"},
      {"trend_id": "T12", "net_effect": "advance", "note": "7 ballistic missiles fired at Kuwait+Bahrain; US intel confirmed Iran regained access to most missile sites/launchers/underground facilities; IRGC: capabilities 'increased' during ceasefire; reconstitution-speed amplifier demonstrated through use 5th cycle"}
    ]
  },
  "finding_cards": [
    {
      "probe_id": "PROBE-1",
      "probe_name": "Mojtaba Khamenei Status",
      "status": "null",
      "confidence": "L",
      "sources": [
        {"name": "Iran International (Day 97 carry-forward; no new Mojtaba signal June 4-6)", "tier": 3}
      ],
      "finding": "No new Mojtaba visual appearance or second-source death confirmation across Days 98-100. The Day 97 written-message baseline (PROBE-1 written-not-visual; IRGC-council legitimacy-shield framing) holds as operative. No new Mojtaba public output in this window. A4 IRGC-council functional-apex reading unchanged.",
      "trigger_match": false,
      "trigger_detail": null,
      "variable_moved": null,
      "discounts_applied": [],
      "conflict_notes": "Principal validation (Step 7b): A4 governance-axis discrimination continues 'increasingly validated' via Vahidi named governance statement (Day 97) + Pezeshkian public IRGC-takeover warning (Day 97) + Rubio T1 Day 96. Vahidi-direct HEU-axis: 6th-plus consecutive cycle without a named Vahidi statement on MOU/HEU. Governance-axis validated; HEU-axis still open. No forcing question needed at this cycle (5th-cycle threshold was met Day 90; A4 governance-axis has since been positively discriminated; HEU-axis is the remaining open sub-item)."
    },
    {
      "probe_id": "PROBE-2",
      "probe_name": "IRGC Factional Signals",
      "status": "partial",
      "confidence": "M",
      "sources": [
        {"name": "PressTV / GlobalSecurity.org IRGC readiness statement June 2", "tier": 3},
        {"name": "Euronews / National Security News (Vahidi IRGC governance; Pezeshkian blocked)", "tier": 3}
      ],
      "finding": "IRGC stated 'armed forces prepared for all scenarios amid heightened military readiness' (PressTV, June 2). Confirmed reporting that Vahidi blocked Pezeshkian from appointing an intelligence minister and that 'all critical and sensitive leadership positions must be decided by the IRGC.' No new Vahidi direct named statement on HEU disposition or MOU terms. Aliabadi silent; Aerospace/Quds divergence null.",
      "trigger_match": false,
      "trigger_detail": {
        "appendix_b_row": "Vahidi direct named statement on MOU/5-preconditions",
        "framework_variable": "A4 apex attribution; BS-12 PA-gap",
        "direction": "no change — governance-axis discrimination already fired Day 97; no new MOU-terms signal",
        "gap_to_full_match": "Vahidi direct named statement on HEU disposition or 5-preconditions specifically"
      },
      "variable_moved": null,
      "discounts_applied": [
        "PressTV: Iranian state media; generic readiness statements carry near-zero analytical weight",
        "Euronews/INSS-sourced Vahidi governance claim is T3 analytical; consistent with Day 97 discrimination but not a new named quote"
      ],
      "conflict_notes": "Vahidi's IRGC governance statements are multi-cycle now; Day 97 discrimination is the most substantive. This cycle adds no new named Vahidi output on MOU terms. The governance-axis finding is accumulating across cycles; the HEU-axis remains the binding gap. No alternative principal hypothesis revision needed: governance-axis discrimination pointing consistently at Vahidi/IRGC council as functional apex is the operational consensus across T2/T3 tiers."
    },
    {
      "probe_id": "PROBE-3",
      "probe_name": "Bazaari / Bonyad Economic Signals",
      "status": "partial",
      "confidence": "M",
      "sources": [
        {"name": "Stimson Center / Al Jazeera (Jan-Feb 2026 Iran Grand Bazaar protest context)", "tier": 3},
        {"name": "Fortune / Yahoo Finance (oil revenue structural constraint; 5% of budget)", "tier": 3},
        {"name": "Iran International (Day 97 carry-forward bazaar closures; no new June 4-6 confirmation)", "tier": 3}
      ],
      "finding": "Day 97 first BS-1b transmission signal (bazaar closures, rial pressure, oil revenue at 5% of budget) carries into this cycle without T1/T2 upgrade. Search results for June 2026 bazaar activity do not produce new named-source confirmation beyond Iran International Day 97 at M confidence. Historical context confirmed: Jan-Feb 2026 protests were the largest since 1979 and originated in the Tehran Grand Bazaar; the merchant class has already demonstrated capacity for regime-threatening closure. The structural economic constraint (oil revenue 5% of budget vs 32% pre-war) is confirmed across multiple sources at T3. BS-1b status: 'first provisional signal in 17-plus null cycles; M confidence; escalate monitoring' holds unchanged.",
      "trigger_match": false,
      "trigger_detail": null,
      "variable_moved": null,
      "discounts_applied": [
        "Iran International: -50% single-source Iranian opposition on internal-politics claims",
        "Historical Jan-Feb 2026 protest context: from prior cycle, not new signal this window"
      ],
      "conflict_notes": "The structural economic data (oil revenue 5% of budget) is independently confirmed and is not subject to the -50% discount. It does not constitute a BS-1b trigger (that requires bazaar closure at T1/T2), but it corroborates the transmission pathway. No new T1/T2 bazaar signal this cycle; BS-1b remains at M confidence provisional. Two consecutive cycles at M confidence (Day 97 + Day 100) without T1/T2 upgrade; recommend daily monitor per PROBE-3 protocol upgrade at next audit."
    },
    {
      "probe_id": "PROBE-6",
      "probe_name": "Chinese Support Calibration",
      "status": "null",
      "confidence": "L",
      "sources": [
        {"name": "General search — no GL-V/Hengli cascade signal June 4-6", "tier": 4}
      ],